{
  "schema_version": "1",
  "id": "alrr-YYYYMMDD-small-location-first-pass-toolset-build",
  "created_at": "",
  "source_dispatch_path": "knowledge-inbox/aurora-live-retest-dispatch.md",
  "dispatch_manifest_path": "",
  "source_review_outcome_id": "alro-YYYYMMDD-small-location-first-pass",
  "source_review_outcome_path": "knowledge-inbox/aurora-live-review-outcomes/records/alro-YYYYMMDD-small-location-first-pass.json",
  "live_record_id": "aurora-live-YYYYMMDD-small-location-first-pass",
  "live_record_path": "knowledge-inbox/aurora-live-records/aurora-live-YYYYMMDD-small-location-first-pass.json",
  "evidence_manifest_path": "knowledge-inbox/aurora-live-evidence-manifests/aurora-live-evidence-manifest-YYYYMMDD-small-location-first-pass.json",
  "target_atom": "toolset.buildAndClientRun",
  "requested_next_action": "Repeat the smallest missing atom from the retest dispatch.",
  "operator": {
    "handle": "",
    "toolset_version": "",
    "nwn_ee_version": "",
    "environment_summary": ""
  },
  "result": "not-run",
  "decision_summary": "Retest result has not been reviewed yet.",
  "passed_atoms": [],
  "partial_atoms": [],
  "failed_atoms": [],
  "blocked_atoms": [],
  "returned_artifacts": [],
  "artifact_hashes": [],
  "checks_run": [],
  "checks_passed": [],
  "privacy_confirmation": {
    "no_private_data": false,
    "quarantine_required": false,
    "summary": ""
  },
  "privacy_findings": [],
  "maintainer_verification": {
    "dispatch_check": false,
    "result_template_check": false,
    "records_check": false,
    "evidence_manifest_check": false,
    "intake_consistency_check": false,
    "redaction_policy_check": false,
    "visual_redaction_check": false,
    "notes": ""
  },
  "next_actions": [
    "Run maintainer verification before any promotion decision."
  ],
  "non_proof_boundaries": [
    "Retest result records prove maintainer intake process only.",
    "They do not prove screenshot truth, log truth, NWN runtime behavior, redaction completeness, release readiness, or automatic skill improvement."
  ],
  "notes": ""
}
